{
  "schemaVersion": "1.0.0",
  "missionId": "mis_STARTER_LOCAL_NODE_01",
  "title": "Investigate a local Node.js service",
  "objective": "Determine the most likely cause of a local Node.js service failure using logs, runtime diagnostics, source code, package metadata, and Git history when available.",
  "mode": "read-only",
  "scope": {
    "environment": "local",
    "include": [
      "logs/**",
      "diagnostics/**",
      "src/**",
      "package.json"
    ],
    "exclude": [
      ".env",
      ".env.*",
      "node_modules/**",
      ".git/**",
      ".ants/**"
    ]
  },
  "permissions": [
    {
      "resourceType": "filesystem",
      "operation": "read",
      "scope": "**"
    },
    {
      "resourceType": "git",
      "operation": "read",
      "scope": "."
    }
  ],
  "budgets": {
    "durationSeconds": 120,
    "maxTasks": 10,
    "maxTaskDepth": 4,
    "maxToolCalls": 200,
    "maxModelTokens": 0,
    "maxEstimatedCostUsd": 0,
    "maxBytesRead": 10485760,
    "maxRetriesPerTask": 1
  },
  "stopConditions": {
    "minimumConfidence": 0.75,
    "requiredIndependentValidations": 1,
    "maxNoProgressTasks": 3,
    "completeWhenDefensible": true,
    "pauseOnSecretDetection": true
  },
  "reporting": {
    "format": "markdown+json",
    "includeEvidenceIndex": true,
    "includeContradictions": true,
    "includeLimitations": true
  },
  "requestedBy": {
    "type": "user",
    "id": "local-user"
  },
  "knownFacts": [],
  "sensitivity": "internal",
  "retentionDays": 7,
  "createdAt": "2026-08-03T00:00:00.000Z"
}
